{
  "mosData": [
    {
      "name": "ГКБ №1",
      "plan": 5000,
      "fact": 3200,
      "percent": 64,
      "growth": 120,
      "colon": 450,
      "zno": 12,
      "noDev": 800,
      "hasDev": 1200
    },
    {
      "name": "ПКБ им. Розанова В.Н.",
      "plan": 4200,
      "fact": 2800,
      "percent": 66.7,
      "growth": 95,
      "colon": 380,
      "zno": 8,
      "noDev": 650,
      "hasDev": 980
    }
  ],
  "weeksData": [
    { "start": "2026-01-06", "end": "2026-01-10", "value": 4100 },
    { "start": "2026-01-13", "end": "2026-01-17", "value": 4350 }
  ],
  "doneText": "Проведён онкоскрининг в пилотных МО.",
  "plansText": "Расширить охват колоноскопией.",
  "period": "13.01.2026 - 17.01.2026"
}
